{
  "id": "018f0000-0000-7000-8000-000000000031",
  "entityId": "018f0000-0000-7000-8000-000000000001",
  "platform": "wallet",
  "platformId": "0x0000000000000000000000000000000000000000",
  "handle": null,
  "verified": false,
  "metadata": {
    "chain": "ethereum"
  },
  "createdAt": "2026-05-20T00:00:00.000Z",
  "updatedAt": "2026-05-20T00:00:00.000Z",
  "schemaVersion": "0.1.0"
}
