{
  "id": "018f0000-0000-7000-8000-000000000030",
  "entityId": "018f0000-0000-7000-8000-000000000001",
  "platform": "discord",
  "platformId": "1234567890",
  "handle": "example-user",
  "verified": true,
  "metadata": {},
  "createdAt": "2026-05-20T00:00:00.000Z",
  "updatedAt": "2026-05-20T00:00:00.000Z",
  "schemaVersion": "0.1.0"
}
